{"$schema":"https://json-schema.org/draft/2020-12/schema","$id":"https://vsn.dev/contracts/p30-bootstrap-plan-v1.schema.json","title":"P30 Bootstrap Plan v1","type":"object","required":["schema_version","product_version","rust_toolchain","pack_id","host","commands","notes"],"properties":{"schema_version":{"const":1},"product_version":{"type":"string"},"rust_toolchain":{"type":"string"},"pack_id":{"type":"string"},"host":{"type":"string"},"commands":{"type":"array","items":{"type":"string"}},"notes":{"type":"array","items":{"type":"string"}}},"additionalProperties":false}
